"keyword_id","preferred_label_en","preferred_label_jp","category","scope_note","use_for","related_terms"
"DIPLOMATIC_LIAISON","Diplomatic Liaison","外交連絡／連絡官","diplomatic practice","Use for records concerning liaison officers, contact arrangements, diplomatic channels, or appointment of contact persons.","連絡官;連絡体制;外交連絡;liaison officer;diplomatic liaison","DIP;POST_CONFERENCE_FOLLOW_UP;CONFERENCE_DIPLOMACY"
"JAPANESE_POSITION","Japanese Position","日本の態度／日本の立場","diplomatic position","Use for records centered on the official position, policy line, or stance of Japan toward an international conference, issue, or diplomatic question.","日本の態度;日本の立場;日本側方針;Japanese position","JAPANESE_FOREIGN_POLICY;POLICY_PREPARATION;DIP"
"POLICY_PREPARATION","Policy Preparation","政策準備／方針準備","diplomatic practice","Use for preparatory policy materials, reference materials, drafts, instructions, or internal position-making before a conference or diplomatic negotiation.","参考資料;方針準備;政策準備;事前準備;policy preparation","JAPANESE_POSITION;CONFERENCE_DIPLOMACY;JAPANESE_DIPLOMATIC_REPORTING"
"SECURITY","Security","安全保障","security","Use for records concerning security affairs, defense questions, alliances, regional security, or strategic issues.","安全保障;安保;security","MILITARY;US_ALLIANCE_SYSTEM_IN_ASIA;REGIONAL_SECURITY_IN_SOUTHEAST_ASIA"
"MILITARY","Military Affairs","軍事","security","Use for records concerning military affairs, defense forces, armaments, military policy, or military aspects of diplomacy.","軍事;軍備;兵力;military","SECURITY;WEAPONS;ARMAMENTS"
"NUCLEAR_ISSUES","Nuclear Issues","核・原子力問題","security / technology","Use for records concerning nuclear weapons, nuclear energy, atomic issues, nuclear development, or diplomatic positions on nuclear questions.","原子力問題;核問題;核兵器;atomic issues;nuclear issues","SECURITY;MILITARY;PRC_POSITION_ON_NUCLEAR_ISSUES"
"PRC_POSITION_ON_NUCLEAR_ISSUES","PRC Position on Nuclear Issues","原子力問題に対する中共の態度","security / PRC diplomacy","Use for records specifically concerning the PRC or Communist China position on atomic or nuclear issues.","原子力問題に対する中共の態度;中共の核問題態度;PRC position on nuclear issues","PRC;NUCLEAR_ISSUES;SECURITY"
"NATIONAL_LIBERATION_MOVEMENT","National Liberation Movement","民族解放運動","political movement / decolonization","Use for records concerning national liberation movements, anti-colonial political-military movements, or diplomacy involving liberation movements as non-state actors.","民族解放運動;解放運動;liberation movement;national liberation movement","DECOL;THIRD_WORLD;VIET_MINH;CONFERENCE_DIPLOMACY"
"INVITATION","Invitation","招請／招待","conference diplomacy","Use for records concerning invitations, invitation policy, invitee selection, or diplomatic disputes over who should be invited to a conference.","招請;招待;招請問題;参加招請;invitation","PARTICIPATION;CONFERENCE_DIPLOMACY;PRC_ROC_COMPETITION"
"PARTICIPATION_INTENTION","Participation Intention","参加意向","conference diplomacy","Use for records concerning whether governments or political entities intend to participate, decline, or condition participation in a conference.","参加意向;参加希望;参加可否;participation intention","PARTICIPATION;INVITATION;CONFERENCE_DIPLOMACY"
"ORGANIZATIONAL_STRUCTURE","Organizational Structure","組織構造","organization / institutional structure","Use for records concerning committees, standing bodies, executive organs, domestic committees, regional branches, or institutional structure of an organization or movement.","組織構造;地区別委員会;国内委員会;常設委員会;執行委員会;organizational structure","AAPSO;TRANSNATIONAL_POLITICAL_ORGANIZATION;COMMITTEE"
"COMMITTEE_ACTIVITIES","Committee Activities","委員会活動","organization / institutional practice","Use for records concerning committee meetings, permanent committees, executive committees, national committees, or regional committee activities.","委員会;常設委員会;執行委員会;国内委員会;committee activities","ORGANIZATIONAL_STRUCTURE;AAPSO"
"ECONOMIC_SEMINAR","Economic Seminar","経済ゼミナール","conference / seminar","Use for records concerning economic seminars, study meetings, or seminar-series activity within diplomatic, solidarity, or transnational political organizations.","経済ゼミナール;経済セミナー;economic seminar","ECON_COOP;AAPSO;PEOPLES_DIPLOMACY"
"TRANSNATIONAL_POLITICAL_ORGANIZATION","Transnational Political Organization","越境的政治組織","organization type / political movement","Use for records concerning organizations or movements operating across national borders as political, solidarity, or ideological networks.","越境的政治組織;国際政治組織;transnational political organization","AAPSO;PEOPLES_DIPLOMACY;NATIONAL_LIBERATION_MOVEMENT"
"INTERNATIONAL_ORGANIZATION_ELECTIONS","International Organization Elections","国際機関選挙","international_organization","Elections for positions, judges, officers, or representatives in international organizations or related organs.","国際機関選挙; 国際機関の選挙; 国際機関人事; election in international organizations","JUDICIAL_ELECTIONS; UN; ICJ"
"JUDICIAL_ELECTIONS","Judicial Elections","裁判官選挙","international_law","Elections of judges for international courts or judicial bodies, including the International Court of Justice.","裁判官選挙; 判事選挙; ICJ judge election; judicial election","INTERNATIONAL_ORGANIZATION_ELECTIONS; ICJ; UN"
"DIPLOMATIC_RECOGNITION","Diplomatic Recognition","外交承認","diplomacy","Recognition of states, governments, or diplomatic relations.","外交承認; 国家承認; diplomatic recognition","GOVERNMENT_RECOGNITION_ISSUE; RECOGNITION_COMPETITION; PRC_ROC_COMPETITION"
"GOVERNMENT_RECOGNITION_ISSUE","Recognition of Governments","政権承認問題","diplomacy","Questions of recognizing foreign governments or regimes.","政権承認問題; 政権承認; recognition of governments","DIPLOMATIC_RECOGNITION; RECOGNITION_COMPETITION"
"RECOGNITION_COMPETITION","Recognition Competition","承認競争","diplomacy","Competition among governments or political entities over diplomatic recognition.","承認競争; 国交樹立競争; recognition competition","DIPLOMATIC_RECOGNITION; PRC_ROC_COMPETITION"
"POLITICAL_WORK","Political Work","政治工作","political activity","Political work, influence activity, or organized political operations by a state, party, or movement.","政治工作; political work; political operations","INFLUENCE_OPERATIONS; PROPAGANDA; SOUTHEAST_ASIA_COMMUNISM"
"INFLUENCE_OPERATIONS","Influence Operations","影響工作","political activity","Activities intended to shape opinion, alignments, or political behavior in another country or region.","影響工作; 対外工作; influence operations; political influence","POLITICAL_WORK; PROPAGANDA; DIPLOMATIC_LOBBYING"
"PRC_BURMA_RELATIONS","PRC-Burma Relations","中共・ビルマ関係","bilateral relations","Bilateral relations between the People's Republic of China and Burma/Myanmar.","ビルマ・中共関係; 中共・ビルマ関係; PRC-Burma relations; China-Burma relations","BILAT; POLITICAL_WORK; COLD_WAR_IN_SOUTHEAST_ASIA"
"LIAISON_OFFICER_APPOINTMENT","Liaison Officer Appointment","連絡官任命","diplomatic practice","Appointment of liaison officers or contact officials for conference follow-up or diplomatic coordination.","連絡官任命; 連絡官任命関係; liaison officer appointment","DIPLOMATIC_LIAISON; POST_CONFERENCE_FOLLOW_UP; BANDUNG_CONFERENCE"
"CONFERENCE_FOLLOW_UP_MECHANISM","Conference Follow-up Mechanism","会議後連絡体制","conference diplomacy","Post-conference liaison arrangements, follow-up mechanisms, or coordination structures.","会議後連絡体制; 会議連絡官; post-conference mechanism","POST_CONFERENCE_FOLLOW_UP; DIPLOMATIC_LIAISON; LIAISON_OFFICER_APPOINTMENT"
bloc_id	preferred_label_en	preferred_label_jp	bloc_type	broader_bloc_id	active_period	status	scope_note	use_when	do_not_use_when	aliases_original_terms	related_region_ids	related_organization_ids	example_applications	notes
SOCIALIST_BLOC	Socialist Bloc / Socialist Camp	社会主義圏／社会主義陣営	political-ideological bloc		Cold War era	approved	Broad collective category for socialist states when the source treats them as a political or diplomatic camp. May include the USSR, Eastern Europe, the PRC, and other socialist states depending on source usage.	Use when the source explicitly says 社会主義諸国, 社会主義圏, 社会主義陣営, 共産圏諸国, or otherwise treats socialist states as a collective actor.	Do not use merely because one or more socialist states appear individually. Do not infer it from USSR, PRC, or Eastern European country names alone.	社会主義諸国;社会主義圏;社会主義陣営;共産圏諸国;socialist countries;socialist camp;communist countries	EASTERN_EUROPE;EAST_ASIA;ASIA;EUROPE		2016-2224: 「ソ連・共産圏諸国」; 2013-3130 and 2013-3131: 「共産圏諸国」	Preferred general bloc ID for explicit collective socialist/camp wording. Preserve the exact original wording in original_terms.
EASTERN_BLOC	Eastern Bloc	東側陣営／東欧圏	geopolitical bloc	SOCIALIST_BLOC	c. 1947-1991	approved	USSR-led political and strategic bloc centered on Eastern Europe.	Use when the source explicitly treats the USSR and Eastern European states as an integrated political bloc, Eastern bloc, Soviet bloc, or 東側陣営.	Do not use for Eastern Europe as geography. Do not automatically include the PRC. Use EASTERN_EUROPE in region_ids for geographic references.	東側陣営;東欧圏;ソ連圏;ソ連ブロック;Eastern bloc;Soviet bloc	EASTERN_EUROPE;EUROPE		Use only where collective USSR-East European alignment is explicit; not for files merely listing USSR and Eastern European countries.	PRC is normally outside this bloc ID unless the historical source itself groups it together.
WESTERN_BLOC	Western Bloc	西側陣営	geopolitical bloc		Cold War era	approved	US-led Western political, strategic, and diplomatic camp.	Use when the source explicitly says 西側諸国, 西側陣営, 自由主義陣営, or treats Western states as a collective political actor.	Do not use for Western Europe as geography or merely because the USA, UK, France, or other Western states appear individually.	西側諸国;西側陣営;自由主義陣営;Western bloc;Western camp	NORTH_AMERICA;WESTERN_EUROPE;EUROPE	NATO	Potential use in records explicitly contrasting 東西両陣営 or Western and socialist camps.	NATO is an organization and should remain in organization_ids; WESTERN_BLOC expresses the broader camp.
NON_ALIGNED_MOVEMENT	Non-Aligned Movement	非同盟運動／非同盟諸国	diplomatic movement		1961-present	approved	Formal or clearly identified collective diplomacy of non-aligned states.	Use for 非同盟諸国首脳会議, 非同盟運動, NAM, or records explicitly treating non-aligned states as a coordinated diplomatic group.	Do not use merely because states are commonly described by historians as non-aligned, or because a neutral mediation proposal appears.	非同盟運動;非同盟諸国;非同盟諸国首脳会議;NAM;Non-Aligned Movement;non-aligned countries;Non-Aligned;non-aligned states;非同盟	GLOBAL;AFRO_ASIA;ASIA;AFRICA;MIDEAST;LATIN_AMERICA		2013-2435: Third Non-Aligned Countries Summit, if confirmed in the record.	Use only where the non-aligned identity is explicit. Neutral states or mediation groups are not automatically NAM. Canonical ID is NON_ALIGNED_MOVEMENT; NON_ALIGNED may be treated as a search alias, not a separate bloc_id.
AFRO_ASIAN_BLOC	Afro-Asian Bloc	アジア・アフリカ諸国グループ／AAブロック	diplomatic-voting bloc		mainly 1950s-1970s	approved	Asian and African states acting collectively as a diplomatic, voting, or negotiating group.	Use when the source explicitly describes アジア・アフリカ諸国, AA諸国, or an Afro-Asian group as a coordinated collective actor, common position, voting bloc, or negotiating group.	Do not use merely because a record concerns both Asia and Africa, Bandung, AAPSO, or letters sent to Asian and African leaders.	AA諸国;アジア・アフリカ諸国グループ;アジア・アフリカ・ブロック;Afro-Asian bloc;Afro-Asian group	AFRO_ASIA;ASIA;AFRICA		Possible in UN voting/negotiating records where AA states are explicitly treated as a common bloc; not automatic for Bandung records.	Keep AFRO_ASIA in region_ids for geographic/diplomatic space; use this bloc only for coordinated collective action. Distinguish from region_id AFRO_ASIA and organization_id AAPSO.
GROUP_OF_77	Group of 77	77か国グループ	multilateral negotiating coalition		1964-present	approved	Developing-country negotiating coalition in the UN system, especially UNCTAD and economic-development diplomacy.	Use when G77, Group of 77, 77か国グループ, or 77カ国（開発途上国）グループ is explicitly identified.	Do not use for developing countries generally when no G77 identity or collective action is stated.	G77;Group of 77;77か国グループ;77カ国（開発途上国）グループ;開発途上国77か国グループ	GLOBAL;ASIA;AFRICA;LATIN_AMERICA;MIDEAST	UN;UNCTAD	2011-0193: UNCTAD Third Session preparations.	Can be stored in bloc_ids even though it is also a durable coalition; avoid duplicating in organization_ids unless the schema intentionally permits both.
GROUP_B	UNCTAD Group B	UNCTAD・Bグループ（先進国グループ）	multilateral negotiating group		UNCTAD era	approved	Developed-country negotiating group used in UNCTAD conference diplomacy.	Use when Bグループ, Group B, or 先進国グループ is explicitly used in an UNCTAD or related negotiating context.	Do not use for developed countries generally outside an explicit Group B context.	Bグループ;B（先進国）グループ;Group B;developed countries group	GLOBAL;NORTH_AMERICA;WESTERN_EUROPE;OCEANIA	UNCTAD	2011-0193: B（先進国）グループ会合.	Conference-specific negotiating group, not synonymous with WESTERN_BLOC.
AFRICAN_GROUP	African Group	アフリカ・グループ	regional diplomatic-voting group		UN era	approved_conditional	African states acting collectively as a formal or clearly coordinated regional group in the UN, UNCTAD, or another multilateral forum.	Use when the source explicitly says アフリカ・グループ, African Group, common African position, or documents a coordinated African negotiating/voting group.	Do not use merely for アフリカ諸国, an African-states luncheon, or a list of African country reactions without collective coordination.	アフリカ・グループ;アフリカ諸国グループ;African Group;African states group	AFRICA	UN;UNCTAD	2011-0193: アフリカ各グループ会合, if the meeting is explicitly a negotiating group.	Conditional because Japanese archival wording may use アフリカ諸国 loosely; verify collective institutional action.
ASIAN_GROUP	Asian Group	アジア・グループ	regional diplomatic-voting group		UN era	approved_conditional	Asian states acting collectively as a formal or clearly coordinated regional group in a multilateral forum.	Use when the source explicitly says アジア・グループ, Asian Group, common Asian position, or documents a coordinated Asian negotiating/voting group.	Do not use merely for アジア諸国, regional coverage, or a list of Asian country reactions.	アジア・グループ;アジア諸国グループ;Asian Group;Asian states group	ASIA	UN;UNCTAD	2011-0193: アジア・グループ会合.	Use ASIA in region_ids for geography; this bloc ID requires collective negotiating or voting action.
ARAB_STATES_GROUP	Arab States Group	アラブ諸国グループ	regional-cultural diplomatic group		20th century-present	approved_conditional	Arab states treated collectively as a diplomatic, voting, or negotiating group.	Use when the source explicitly treats アラブ諸国 as a common diplomatic group, joint position, voting group, or collective interlocutor.	Do not use for Middle East geography, individual Arab countries, the United Arab Republic as a single entity, or merely because the Arab League appears.	アラブ諸国;アラブ諸国グループ;Arab states;Arab group;Arab bloc	MIDEAST;NORTH_AFRICA;AFRICA	LAS	Potential in records explicitly documenting collective Arab-state diplomacy; an アラブ諸国招待ランチ alone is insufficient.	ARAB_WORLD is better treated as a cultural-geographic concept, not as this bloc. LAS remains an organization. Use only for explicit collective Arab-state diplomacy; keep ARAB_WORLD outside bloc_ids unless the source frames it as a diplomatic group.
FREE_WORLD	Free World	自由世界／自由圏	historical ideological category	WESTERN_BLOC	Cold War era	source_explicit_only	Historical Cold War category used by contemporary sources for non-communist or Western-aligned states.	Use only when the source itself uses 自由世界, 自由圏, free world, or an equivalent historical category.	Do not apply as a modern analytical label and do not infer it from pro-Western alignment.	自由世界;自由圏;自由主義世界;free world	GLOBAL		Useful for archival titles or foreign-policy overviews employing Cold War ideological terminology.	Preserve source language because this is a historically loaded category.
ASIAN_FREE_WORLD	Asian Free World	アジア自由圏	historical regional ideological category	FREE_WORLD	Cold War era	source_explicit_only	Source-defined category for Asian states placed in the 'free world' camp.	Use only where アジア自由圏 or Asian free world appears explicitly in the source or table of contents.	Do not infer from Asian allies of the USA or non-communist Asian states.	アジア自由圏;Asian Free World;Free Asia	ASIA		New Zealand foreign-policy overview record with an explicit アジア自由圏 section.	Keep separate from ASIA as geography and WESTERN_BLOC as the general political camp.
ASIAN_COMMUNIST_BLOC	Asian Communist Bloc	アジア共産圏	historical regional ideological category	SOCIALIST_BLOC	Cold War era	source_explicit_only	Source-defined category for Asian communist states treated collectively.	Use only where アジア共産圏, Asian communist bloc, or an equivalent source term appears explicitly.	Do not infer merely from PRC, North Korea, North Vietnam, or other communist states appearing together.	アジア共産圏;Asian Communist Bloc;communist Asia	ASIA;EAST_ASIA;SOUTHEAST_ASIA		New Zealand foreign-policy overview record with an explicit アジア共産圏 section.	This is a source-language bloc category, not a default analytical classification.
keyword_id	preferred_label_en	preferred_label_jp	category	scope_note	use_for	related_terms
CW	Cold War	冷戦	period/framework	Use for records whose importance lies in Cold War alignments, bloc politics, or superpower competition.	冷戦; East-West conflict; superpower rivalry	Third World; Diplomatic Recognition; United Nations
DIP	Diplomacy	外交	general	General diplomatic relations, communications, visits, negotiations, or policy analysis.	外交; diplomatic relations; foreign policy	Bilateral Relations; Diplomatic Recognition; Official Visits
BILAT	Bilateral Relations	二国間関係	relationship type	Use for records centered on relations between two states/governments.	relations; bilateral diplomacy; 二国間外交	Diplomacy
REC	Diplomatic Recognition	国家承認／外交承認	diplomatic status	Use for recognition of states/governments or establishment/withdrawal of formal recognition.	recognition; 承認; 国家承認; government recognition	Diplomatic Normalization; China Representation
NORM	Diplomatic Normalization	国交正常化	diplomatic status	Use for normalization or establishment/restoration of diplomatic relations.	normalization; establishment of diplomatic relations; 国交正常化; 外交関係樹立	Diplomatic Recognition; Japan-PRC Relations
REP_CHINA	China Representation	中国代表権問題	international organization	Use for the question of who represented China in the UN or other international organizations. Pair with entity_ids PRC, ROC, TWN, or CHN_AMBIG as needed.	China seat; Chinese representation; 中国代表権; lawful rights of the PRC	United Nations; Voting / Attitudes of Countries; Diplomatic Recognition; PRC; ROC; Taiwan
UN	United Nations	国連	international organization	Use for UN-related records, including General Assembly, Security Council, representation, conferences, and consultations.	UN; United Nations; 国際連合; 国連	UN General Assembly; China Representation; UNCTAD
UNGA	UN General Assembly	国連総会	international organization	Use for records specifically concerning the UN General Assembly.	General Assembly; UNGA; 国連総会	United Nations; Voting
UNSC	UN Security Council	国連安全保障理事会	international organization	Use for Security Council records or institutional implementation involving the Security Council.	Security Council; UNSC; 安保理	United Nations; China Representation
UNCTAD	UNCTAD	国連貿易開発会議	international organization	Use for UNCTAD-related records and conferences.	United Nations Conference on Trade and Development; 国連貿易開発会議	Trade; Development
ICJ	International Court of Justice	国際司法裁判所	international organization	Use for ICJ-related records, including judicial elections.	ICJ; International Court of Justice; 国際司法裁判所	United Nations
VOTE	Voting / Attitudes of Countries	投票／各国の態度	evidence type	Use for records on voting behavior, attitudes, reactions, or positions of countries in international forums.	voting record; attitudes of countries; 各国の態度; 諸外国の反応; reaction of foreign countries	United Nations; Press Commentary; Foreign Reactions
REACT	Foreign Reactions	諸外国の反応	evidence type	Use for records collecting foreign reactions to events, visits, normalization, crises, or diplomatic moves.	reactions; responses; 諸外国の反応; 各国の反応	Voting; Press Commentary
PRESS	Press Commentary	新聞論調／報道	evidence type	Use for records based on press coverage, newspaper commentary, broadcasts, or media reactions.	press; newspaper commentary; broadcast; 報道; 新聞論調; 放送	Foreign Reactions
VISIT	Official Visits	要人訪問	diplomatic practice	Use for visits by heads of government, ministers, or senior officials.	visits; VIP visits; 要人訪問; 首相訪問; 大統領訪問	Diplomacy
CONSULT	Diplomatic Consultations	外交協議	diplomatic practice	Use for regular consultations, informal consultations, or policy coordination between governments.	consultation; regular consultation; 非公式協議; 定期協議	Diplomacy; Embassy Chiefs Conference
EMBASSY_CHIEFS	Embassy Chiefs Conference	在外公館長会議	diplomatic practice	Use for records concerning conferences of heads of Japanese overseas missions.	在外公館長会議; heads of missions conference	Diplomatic Consultations; Regional Diplomacy
AFRO_ASIAN_CONF	Asian-African Conference	アジア・アフリカ会議	conference/movement	Use for Bandung/Asian-African Conference-related records, including Japanese attitudes and foreign participation.	Afro-Asian Conference; Asian-African Conference; Bandung; アジア・アフリカ会議; バンドン会議	Third World; Non-Aligned Movement; Decolonization
AAPSO	Afro-Asian People's Solidarity	アジア・アフリカ人民連帯	conference/movement	Use for Afro-Asian People’s Solidarity Organization/conference records.	AAPSO; Afro-Asian People's Solidarity; アジア・アフリカ人民連帯会議	Asian-African Conference; Third World
NAM	Non-Aligned Movement	非同盟運動	conference/movement	Use where non-alignment is central or where Afro-Asian/Third World diplomacy overlaps with non-aligned politics.	non-aligned; nonalignment; 非同盟	Third World; Asian-African Conference
THIRD_WORLD	Third World Diplomacy	第三世界外交	analytical theme	Use for PRC diplomacy toward Asia, Africa, Middle East, and decolonizing countries during the Cold War.	Third World diplomacy; Global South; Afro-Asian diplomacy; 第三世界外交	Foreign Aid; Decolonization; Asian-African Conference
DECOL	Decolonization	脱植民地化	analytical theme	Use for independence, recognition of newly independent states, and postcolonial international politics.	decolonization; independence; 独立; 脱植民地化	Angola Independence; Congo Crisis; Third World Diplomacy
JPN_PRC	Japan-PRC Relations	日中関係／日中国交正常化	bilateral theme	Use for Japan-PRC relations, especially normalization, reactions to normalization, and Japanese policy toward the PRC. Pair with ROC/TWN when Taiwan-related consequences are central.	Japan-China relations; Japan-PRC relations; 日中関係; 日中国交正常化	Diplomatic Normalization; Diplomatic Recognition
SINO_SOVIET	Sino-Soviet Relations	中ソ関係	bilateral theme	Use for PRC-Soviet/Sino-Soviet relations and conflicts.	Sino-Soviet; China-Soviet; 中ソ; 中国・ソ連関係	Cold War
SINO_FRENCH	France-PRC Relations	中仏関係／中共・フランス関係	bilateral theme	Use for France-PRC relations, especially establishment of diplomatic relations in 1964 and its effects on Taiwan/ROC diplomacy.	Sino-French relations; PRC-France relations; 中共・フランス関係; フランス・中共外交関係樹立	Diplomatic Recognition; Diplomatic Normalization
