
"mofa_100_013459","entity_ambiguity","IV_ENTITY_AMBIGUOUS","OPEN","entity_review_required"
"mofa_100_013459","entity_ambiguity","TZ_ENTITY_AMBIGUOUS","OPEN","entity_review_required"
"mofa_100_013459","entity_ambiguity","ARAB_UNION_ENTITY_AMBIGUOUS","OPEN","entity_review_required"
"mofa_100_013459","entity_ambiguity","CONGO_ENTITY_AMBIGUOUS","OPEN","entity_review_required"
"mofa_100_013459","entity_ambiguity","VIETNAM_ENTITY_AMBIGUOUS","OPEN","entity_review_required"
"mofa_100_101500","entity_ambiguity","CONGO_ENTITY_AMBIGUOUS","OPEN","entity_review_required"
"mofa_100_013445","entity_ambiguity","VIETNAM_ENTITY_AMBIGUOUS","OPEN","entity_review_required"
"mofa_100_030772","entity_ambiguity","NYASALAND_HISTORICAL_TERRITORY","OPEN","entity_review_required"
"mofa_100_030772","entity_ambiguity","WEST_GERMANY_HISTORICAL_STATE","OPEN","entity_review_required"
"mofa_100_030772","entity_ambiguity","YEMEN_ENTITY_AMBIGUOUS","OPEN","entity_review_required"

"analytical_context_id","preferred_label_en","preferred_label_jp","context_type","scope_note","use_when","do_not_use_when","related_keyword_ids","related_region_ids","related_entity_ids","notes"
"COLD_WAR_IN_SOUTHEAST_ASIA","Cold War in Southeast Asia","東南アジアにおける冷戦","regional analytical frame","Cold War rivalry, alignments, conflicts, and diplomacy in Southeast Asia.","Use when a record is best interpreted through Cold War dynamics in Southeast Asia, including Cambodia, Vietnam, Laos, ASEAN diplomacy, or regional crisis diplomacy.","Do not use merely because a Southeast Asian country appears without Cold War/regional conflict relevance.","CW;CAMBODIA_Q;INDOCHINA_CONFLICT;ASEAN_DIPLOMACY","SOUTHEAST_ASIA;ASIA","KHM;VNM;LAO;THA;PRC;USSR","Analytical context, not necessarily an original source term."
"SOUTHEAST_ASIAN_COMMUNIST_POLITICS","Southeast Asian Communist Politics","東南アジア共産主義政治","ideological/regional analytical frame","Communist parties, regimes, armed movements, and ideological politics in Southeast Asia.","Use for records concerning communist politics in Cambodia, Vietnam, Laos, or wider Southeast Asia, including party-state conflict and regional revolutionary politics.","Do not use merely for any socialist/communist country outside Southeast Asian political context.","SOUTHEAST_ASIA_COMMUNISM;INDOCHINA_CONFLICT;CAMBODIA_Q;CW","SOUTHEAST_ASIA","KHM;VNM;LAO;PRC;USSR","Analytical context; keep separate from organization_type political_party unless a named party is tagged."
"SINO_SOVIET_RIVALRY_IN_SOUTHEAST_ASIA","Sino-Soviet Rivalry in Southeast Asia","東南アジアにおける中ソ対立","geopolitical analytical frame","Competition between the PRC and Soviet Union as it shaped Southeast Asian conflicts and diplomacy.","Use when PRC/Soviet rivalry is relevant to Cambodia, Vietnam, Laos, ASEAN, or Indochina diplomacy.","Do not use for all Sino-Soviet records unless Southeast Asia is central.","SINO_SOVIET;CW;INDOCHINA_CONFLICT;CAMBODIA_Q","SOUTHEAST_ASIA;EAST_ASIA","PRC;USSR;VNM;KHM","Useful for Cambodia/Kampuchea files where Vietnam-Soviet and PRC positions frame the conflict."
"PRC_VIETNAM_RIVALRY","PRC-Vietnam Rivalry","中越対立／中国・ベトナム対立","bilateral/regional analytical frame","Rivalry or confrontation between the PRC and Vietnam, especially as it affected Cambodia/Kampuchea and Southeast Asian diplomacy.","Use when Chinese and Vietnamese positions, rivalry, or conflict are central to the record.","Do not use merely because both PRC and Vietnam are mentioned separately without rivalry/contextual linkage.","VIETNAM_CAMBODIA_CONFLICT;INDOCHINA_CONFLICT;CW","SOUTHEAST_ASIA;EAST_ASIA","PRC;VNM;KHM","Analytical context; not a substitute for entity_ids PRC and VNM."
"REGIONAL_IDEOLOGICAL_CONFLICT","Regional Ideological Conflict","地域的イデオロギー対立","broad analytical frame","Regional conflict structured by ideological divisions, revolutionary movements, communist politics, or anti-communist diplomacy.","Use when a record is best interpreted as part of regional ideological conflict rather than ordinary bilateral diplomacy.","Do not use when ideology is incidental or not visible from the record context.","CW;SOUTHEAST_ASIA_COMMUNISM;LIBERATION;DIP","SOUTHEAST_ASIA;ASIA;GLOBAL","","Broad analytical context; apply sparingly."
"COMMUNIST_PARTY_POLITICS","Communist Party Politics","共産党政治","party/ideological analytical frame","Analytical frame for communist party politics, party-state relations, intra-communist conflict, and communist movement dynamics.","Use when communist party politics, party-state rivalry, or communist movement dynamics are central to interpreting the record.","Do not use merely because a communist state is mentioned without party-political relevance.","SOUTHEAST_ASIA_COMMUNISM;CW;DIP","GLOBAL;SOUTHEAST_ASIA;EAST_ASIA","PRC;VNM;KHM;USSR","Analytical context, not an organization tag. Use political_party organization_type only when tagging a named party as an organization."
"DECOLONIZATION_AND_UN_DIPLOMACY","Decolonization and UN Diplomacy","脱植民地化と国連外交","historical/diplomatic analytical frame","UN diplomacy shaped by decolonization, newly independent states, and postcolonial voting politics.","Use when UN diplomacy is connected to decolonization, postcolonial state participation, or newly independent states.","Do not use for all UN records unless decolonization or postcolonial dynamics are analytically relevant.","DECOL;UN;UNGA;VOTE;REP_CHINA","GLOBAL;AFRICA;ASIA;MIDEAST","PRC;ROC","Analytical context, not a bloc assignment."
"POSTCOLONIAL_STATES_AND_CHINA_REPRESENTATION","Postcolonial States and China Representation","ポストコロニアル諸国と中国代表権問題","historical/diplomatic analytical frame","Role of postcolonial or newly independent states in the China representation question.","Use for China representation records where Asian, African, Middle Eastern, or newly independent state attitudes are central.","Do not infer specific colonial legacy tags if individual countries are not identified.","UN_CHINA_REPRESENTATION_ISSUE;REP_CHINA;DECOL;THIRD_WORLD;VOTE","ASIA;AFRICA;MIDEAST;GLOBAL","PRC;ROC","Use as analytical context even when individual-country colonial heritage cannot be tagged."
"THIRD_WORLD_RESPONSES_TO_CHINA_REPRESENTATION","Third World Responses to China Representation","第三世界の中国代表権問題への反応","Third World / diplomatic reaction analytical frame","Responses of Asian, African, Middle Eastern, Latin American, or postcolonial states to the UN China representation issue.","Use when reactions or attitudes of Third World or postcolonial states toward the China representation issue are relevant.","Do not treat this as proof of AFRO_ASIAN_BLOC or other bloc action unless collective coordination is explicit.","THIRD_WORLD;UN_CHINA_REPRESENTATION_ISSUE;INTERNATIONAL_REACTION;FOREIGN_GOVERNMENT_ATTITUDES","ASIA;AFRICA;MIDEAST;LATIN_AMERICA;GLOBAL","PRC;ROC","Analytical context only; bloc_ids remain source-explicit."
"FRENCH_COLONIAL_LEGACY_IN_AFRICA","French Colonial Legacy in Africa","アフリカにおけるフランス植民地遺産","colonial legacy / postcolonial analytical frame","French colonial rule and its postcolonial diplomatic legacy in Africa, including Francophone African states, decolonization, recognition diplomacy, and PRC/ROC/France competition or influence in former French colonial spaces.","Use when a record explicitly concerns France in Africa, former French colonies, Francophone Africa, or African diplomatic alignments where the French colonial/postcolonial connection is historically central.","Do not use merely because Africa, France, or French language appears. Do not use for Belgian, British, Portuguese, or Spanish colonial legacies unless the French colonial/postcolonial connection is also explicit.","DECOL;RECOG;DIP;PRC_AFRICA;PRC_ROC_COMPETITION;SINO_FRENCH","AFRICA;NORTH_AFRICA;SUBSAHARAN_AFRICA","FRA;PRC;ROC","Analytical context. Apply after checking original table of contents or document content; do not infer from broad Africa regional labels alone."
"COLD_WAR_SECURITY_ARCHITECTURE_IN_ASIA","Cold War Security Architecture in Asia","アジアにおける冷戦期安全保障構造","security / geopolitical analytical frame","Cold War alliance systems, regional security arrangements, military alignments, and strategic architecture in Asia.","Use when a record links Asian diplomacy to Cold War security structures, alliance systems, military questions, or regional security architecture.","Do not use for all Asia records or all Cold War records without a visible security architecture dimension.","SECURITY;MILITARY;NUCLEAR_ISSUES;US_PRC_RAPPROCHEMENT","ASIA;EAST_ASIA;SOUTHEAST_ASIA","JPN;PRC;USA","Analytical context; useful for Bandung reference materials that include security and nuclear issues."
"REGIONAL_SECURITY_IN_SOUTHEAST_ASIA","Regional Security in Southeast Asia","東南アジアの地域安全保障","regional security analytical frame","Regional security issues in Southeast Asia, including alliance, neutralism, SEATO context, military/security concerns, and Cold War regional order.","Use when Southeast Asian regional security, SEATO context, or security arrangements around Southeast Asia are relevant to the record.","Do not use merely because Southeast Asian countries appear without security relevance.","SECURITY;MILITARY;SEATO;CONFERENCE_DIPLOMACY","SOUTHEAST_ASIA;ASIA","JPN;PRC;USA;IDN;THA;PHL","Analytical context; not an organization tag."
"US_ALLIANCE_SYSTEM_IN_ASIA","US Alliance System in Asia","アジアにおける米国同盟体制","alliance/security analytical frame","The US-centered alliance and security network in Asia, including bilateral alliances and regional security arrangements such as SEATO when relevant.","Use when a record is best interpreted through US alliance structures or US-led security arrangements in Asia.","Do not use merely because the United States appears.","SECURITY;MILITARY;SEATO","ASIA;EAST_ASIA;SOUTHEAST_ASIA","USA;JPN","Analytical context; keep separate from organization_ids unless a specific organization is a direct subject."

"bloc_id","preferred_label_en","preferred_label_jp","bloc_type","broader_bloc_id","active_period","status","scope_note","use_when","do_not_use_when","aliases_original_terms","related_region_ids","related_organization_ids","example_applications","notes"
"SOCIALIST_BLOC","Socialist Bloc / Socialist Camp","社会主義圏／社会主義陣営","political-ideological bloc","","Cold War era","approved","Broad collective category for socialist states when the source treats them as a political or diplomatic camp. May include the USSR, Eastern Europe, the PRC, and other socialist states depending on source usage.","Use when the source explicitly says 社会主義諸国, 社会主義圏, 社会主義陣営, 共産圏諸国, or otherwise treats socialist states as a collective actor.","Do not use merely because one or more socialist states appear individually. Do not infer it from USSR, PRC, or Eastern European country names alone.","社会主義諸国;社会主義圏;社会主義陣営;共産圏諸国;socialist countries;socialist camp;communist countries","EASTERN_EUROPE;EAST_ASIA;ASIA;EUROPE","","2016-2224: 「ソ連・共産圏諸国」; 2013-3130 and 2013-3131: 「共産圏諸国」","Preferred general bloc ID for explicit collective socialist/camp wording. Preserve the exact original wording in original_terms."
"EASTERN_BLOC","Eastern Bloc","東側陣営／東欧圏","geopolitical bloc","SOCIALIST_BLOC","c. 1947-1991","approved","USSR-led political and strategic bloc centered on Eastern Europe.","Use when the source explicitly treats the USSR and Eastern European states as an integrated political bloc, Eastern bloc, Soviet bloc, or 東側陣営.","Do not use for Eastern Europe as geography. Do not automatically include the PRC. Use EASTERN_EUROPE in region_ids for geographic references.","東側陣営;東欧圏;ソ連圏;ソ連ブロック;Eastern bloc;Soviet bloc","EASTERN_EUROPE;EUROPE","","Use only where collective USSR-East European alignment is explicit; not for files merely listing USSR and Eastern European countries.","PRC is normally outside this bloc ID unless the historical source itself groups it together."
"WESTERN_BLOC","Western Bloc","西側陣営","geopolitical bloc","","Cold War era","approved","US-led Western political, strategic, and diplomatic camp.","Use when the source explicitly says 西側諸国, 西側陣営, 自由主義陣営, or treats Western states as a collective political actor.","Do not use for Western Europe as geography or merely because the USA, UK, France, or other Western states appear individually.","西側諸国;西側陣営;自由主義陣営;Western bloc;Western camp","NORTH_AMERICA;WESTERN_EUROPE;EUROPE","NATO","Potential use in records explicitly contrasting 東西両陣営 or Western and socialist camps.","NATO is an organization and should remain in organization_ids; WESTERN_BLOC expresses the broader camp."
"NON_ALIGNED_MOVEMENT","Non-Aligned Movement","非同盟運動／非同盟諸国","diplomatic movement","","1961-present","approved","Formal or clearly identified collective diplomacy of non-aligned states.","Use for 非同盟諸国首脳会議, 非同盟運動, NAM, or records explicitly treating non-aligned states as a coordinated diplomatic group.","Do not use merely because states are commonly described by historians as non-aligned, or because a neutral mediation proposal appears.","非同盟運動;非同盟諸国;非同盟諸国首脳会議;NAM;Non-Aligned Movement;non-aligned countries;Non-Aligned;non-aligned states;非同盟","GLOBAL;AFRO_ASIA;ASIA;AFRICA;MIDEAST;LATIN_AMERICA","","2013-2435: Third Non-Aligned Countries Summit, if confirmed in the record.","Use only where the non-aligned identity is explicit. Neutral states or mediation groups are not automatically NAM. Canonical ID is NON_ALIGNED_MOVEMENT; NON_ALIGNED may be treated as a search alias, not a separate bloc_id."
"AFRO_ASIAN_BLOC","Afro-Asian Bloc","アジア・アフリカ諸国グループ／AAブロック","diplomatic-voting bloc","","mainly 1950s-1970s","approved","Asian and African states acting collectively as a diplomatic, voting, or negotiating group.","Use when the source explicitly describes アジア・アフリカ諸国, AA諸国, or an Afro-Asian group as a coordinated collective actor, common position, voting bloc, or negotiating group.","Do not use merely because a record concerns both Asia and Africa, Bandung, AAPSO, or letters sent to Asian and African leaders.","AA諸国;アジア・アフリカ諸国グループ;アジア・アフリカ・ブロック;Afro-Asian bloc;Afro-Asian group","AFRO_ASIA;ASIA;AFRICA","","Possible in UN voting/negotiating records where AA states are explicitly treated as a common bloc; not automatic for Bandung records.","Keep AFRO_ASIA in region_ids for geographic/diplomatic space; use this bloc only for coordinated collective action. Distinguish from region_id AFRO_ASIA and organization_id AAPSO."
"GROUP_OF_77","Group of 77","77か国グループ","multilateral negotiating coalition","","1964-present","approved","Developing-country negotiating coalition in the UN system, especially UNCTAD and economic-development diplomacy.","Use when G77, Group of 77, 77か国グループ, or 77カ国（開発途上国）グループ is explicitly identified.","Do not use for developing countries generally when no G77 identity or collective action is stated.","G77;Group of 77;77か国グループ;77カ国（開発途上国）グループ;開発途上国77か国グループ","GLOBAL;ASIA;AFRICA;LATIN_AMERICA;MIDEAST","UN;UNCTAD","2011-0193: UNCTAD Third Session preparations.","Can be stored in bloc_ids even though it is also a durable coalition; avoid duplicating in organization_ids unless the schema intentionally permits both."
"GROUP_B","UNCTAD Group B","UNCTAD・Bグループ（先進国グループ）","multilateral negotiating group","","UNCTAD era","approved","Developed-country negotiating group used in UNCTAD conference diplomacy.","Use when Bグループ, Group B, or 先進国グループ is explicitly used in an UNCTAD or related negotiating context.","Do not use for developed countries generally outside an explicit Group B context.","Bグループ;B（先進国）グループ;Group B;developed countries group","GLOBAL;NORTH_AMERICA;WESTERN_EUROPE;OCEANIA","UNCTAD","2011-0193: B（先進国）グループ会合.","Conference-specific negotiating group, not synonymous with WESTERN_BLOC."
"AFRICAN_GROUP","African Group","アフリカ・グループ","regional diplomatic-voting group","","UN era","approved_conditional","African states acting collectively as a formal or clearly coordinated regional group in the UN, UNCTAD, or another multilateral forum.","Use when the source explicitly says アフリカ・グループ, African Group, common African position, or documents a coordinated African negotiating/voting group.","Do not use merely for アフリカ諸国, an African-states luncheon, or a list of African country reactions without collective coordination.","アフリカ・グループ;アフリカ諸国グループ;African Group;African states group","AFRICA","UN;UNCTAD","2011-0193: アフリカ各グループ会合, if the meeting is explicitly a negotiating group.","Conditional because Japanese archival wording may use アフリカ諸国 loosely; verify collective institutional action."
"ASIAN_GROUP","Asian Group","アジア・グループ","regional diplomatic-voting group","","UN era","approved_conditional","Asian states acting collectively as a formal or clearly coordinated regional group in a multilateral forum.","Use when the source explicitly says アジア・グループ, Asian Group, common Asian position, or documents a coordinated Asian negotiating/voting group.","Do not use merely for アジア諸国, regional coverage, or a list of Asian country reactions.","アジア・グループ;アジア諸国グループ;Asian Group;Asian states group","ASIA","UN;UNCTAD","2011-0193: アジア・グループ会合.","Use ASIA in region_ids for geography; this bloc ID requires collective negotiating or voting action."
"ARAB_STATES_GROUP","Arab States Group","アラブ諸国グループ","regional-cultural diplomatic group","","20th century-present","approved_conditional","Arab states treated collectively as a diplomatic, voting, or negotiating group.","Use when the source explicitly treats アラブ諸国 as a common diplomatic group, joint position, voting group, or collective interlocutor.","Do not use for Middle East geography, individual Arab countries, the United Arab Republic as a single entity, or merely because the Arab League appears.","アラブ諸国;アラブ諸国グループ;Arab states;Arab group;Arab bloc","MIDEAST;NORTH_AFRICA;AFRICA","LAS","Potential in records explicitly documenting collective Arab-state diplomacy; an アラブ諸国招待ランチ alone is insufficient.","ARAB_WORLD is better treated as a cultural-geographic concept, not as this bloc. LAS remains an organization. Use only for explicit collective Arab-state diplomacy; keep ARAB_WORLD outside bloc_ids unless the source frames it as a diplomatic group."
"FREE_WORLD","Free World","自由世界／自由圏","historical ideological category","WESTERN_BLOC","Cold War era","source_explicit_only","Historical Cold War category used by contemporary sources for non-communist or Western-aligned states.","Use only when the source itself uses 自由世界, 自由圏, free world, or an equivalent historical category.","Do not apply as a modern analytical label and do not infer it from pro-Western alignment.","自由世界;自由圏;自由主義世界;free world","GLOBAL","","Useful for archival titles or foreign-policy overviews employing Cold War ideological terminology.","Preserve source language because this is a historically loaded category."
"ASIAN_FREE_WORLD","Asian Free World","アジア自由圏","historical regional ideological category","FREE_WORLD","Cold War era","source_explicit_only","Source-defined category for Asian states placed in the 'free world' camp.","Use only where アジア自由圏 or Asian free world appears explicitly in the source or table of contents.","Do not infer from Asian allies of the USA or non-communist Asian states.","アジア自由圏;Asian Free World;Free Asia","ASIA","","New Zealand foreign-policy overview record with an explicit アジア自由圏 section.","Keep separate from ASIA as geography and WESTERN_BLOC as the general political camp."
"ASIAN_COMMUNIST_BLOC","Asian Communist Bloc","アジア共産圏","historical regional ideological category","SOCIALIST_BLOC","Cold War era","source_explicit_only","Source-defined category for Asian communist states treated collectively.","Use only where アジア共産圏, Asian communist bloc, or an equivalent source term appears explicitly.","Do not infer merely from PRC, North Korea, North Vietnam, or other communist states appearing together.","アジア共産圏;Asian Communist Bloc;communist Asia","ASIA;EAST_ASIA;SOUTHEAST_ASIA","","New Zealand foreign-policy overview record with an explicit アジア共産圏 section.","This is a source-language bloc category, not a default analytical classification."

"entity_id","preferred_label_en","preferred_label_jp","entity_type","iso_alpha3","temporal_scope","use_when","source_terms_aliases","notes"
"PRC","People's Republic of China","中華人民共和国","state/government","CHN","1949-present; UN seat from 1971; Japan diplomatic relations from 1972","Use when the record clearly refers to the PRC government/state, including Japanese archival terms such as 中共.","PRC; People's Republic of China; Communist China; Red China; Peking/Beijing Government; 中共; 中華人民共和国; 北京政府","Preferred controlled term for 中共 in Japanese Cold War diplomatic records. Use CHN_AMBIG only when the intended China entity cannot be resolved."
"ROC","Republic of China","中華民国","state/government","","1912-present; held UN China seat until 1971; Japan diplomatic relations until 1972","Use when the record refers to the ROC government, Nationalist China, or the Chinese Nationalist authorities.","ROC; Republic of China; Nationalist China; Kuomintang Government; Chiang Kai-shek Government; Nationalist Government; 国府; 中華民国; 蒋介石政権; 台北政府","Use for the ROC government/state actor. Often associated with Taiwan after 1949; use TWN separately for Taiwan as place, society, or territory."
"TWN","Taiwan","台湾","territory/place","TWN","1945-present","Use for Taiwan as a place/society/economy, or when the record concerns Taiwan without necessarily referring to the ROC government as diplomatic actor.","Taiwan; Formosa; 台湾; フォルモサ","Use for Taiwan as place, society, territory, or the Taiwan question. Use ROC when the diplomatic actor is the Republic of China government."
"CHN_AMBIG","China Representation and Recognition Competition","中国代表権・承認競争","contested historical representation","","Use especially for records on PRC-ROC/Taiwan competition over diplomatic recognition, state representation, or the China seat in the United Nations.","Use when a record concerns a transitional or contested situation in which PRC, ROC/Taiwan, or the China seat/representation cannot be treated as a single settled entity, especially in diplomatic recognition, normalization, or UN representation contexts.","China; 中国; 中国代表権; 中国代表権問題; 中台国交樹立競争; 中台承認競争; China seat; Chinese representation; recognition competition","Public label intentionally emphasizes contested representation and recognition competition, not mere data ambiguity. Do not use when the source clearly refers only to PRC or only to ROC/Taiwan."
"JPN","Japan","日本","state","JPN","1945-present","Use for Japanese policy, Japanese reactions, Japan-related bilateral relations, or MOFA-origin records where Japan is a subject.","Japan; 日本; 日; Japanese Government","Often implicit in MOFA records; tag only when Japan is a substantive subject, not merely the archive origin."
"USA","United States","米国","state","USA","1945-present","Use for U.S. politics, U.S. visits, U.S.-Japan consultations, or U.S. policy toward China.","United States; USA; U.S.; America; 米国; アメリカ",""
"USSR","Soviet Union","ソ連","state/historical","SUN","1922-1991","Use for Soviet Union as an actor, including Sino-Soviet relations and Japan-Soviet consultations.","Soviet Union; USSR; Soviet; ソ連; ソヴィエト","Use USSR, not Russia, for Cold War Soviet records."
"FRA","France","フランス","state","FRA","1945-present","Use for France, especially PRC-France diplomatic recognition/relations.","France; French; フランス; 仏; 仏国",""
"GBR","United Kingdom","英国","state","GBR","1945-present","Use for UK/Britain, including Japan-UK consultations and British China policy.","United Kingdom; UK; Great Britain; Britain; British; 英国; イギリス",""
"IND","India","インド","state","IND","1947-present","Use for India, including the Sino-Indian border conflict.","India; Indian; インド",""
"MMR","Myanmar/Burma","ビルマ／ミャンマー","state","MMR","1948-present","Use for Burma/Myanmar. For Cold War records, original titles may use Burma.","Burma; Myanmar; Burmese; ビルマ; ミャンマー","Preferred label keeps both names because Cold War Japanese records often use ビルマ."
"NZL","New Zealand","ニュージーランド","state","NZL","1947-present","Use for New Zealand diplomacy.","New Zealand; ニュー・ジーランド; ニュージーランド",""
